repair_id,customer_name,description,cost,drop_off_date,collection_date,status
1,Rafael,Replace inner tube,50.0,2025-05-14,25/05/2025,collected
2,Joe,Rear tyre puncture,15.0,2025-05-15,25/05/2025,Customer contacted
3,Lucas,Front wheel neeeds to be replaced,500.0,2025-05-16,30/05/2025,Open
4,Lucas,Puncture on the rear wheel,20.0,2025-05-16,30/05/2025,Customer contacted
6,Joe,Front wheel has to be replaced and it needs new rim tape,50.0,2025-05-16,01/06/2025,Ready for collection
7,Michael,Gears need to be adjusted,100.0,2025-05-16,02/06/2025,"Missing spare part, collection might be delayed"
